{
  "schema": "root-logos-work-edition/v1",
  "edition_id": "micheas-de2b5526--v11-read-acbd48-436aa43d",
  "work_id": "micheas-de2b5526",
  "created_at": "2026-07-27T14:23:43.748Z",
  "root_logos_revision": "v1.1",
  "source_hash": "b4319d43436aa43d2901b3b96272fbce599ab6bd2fcddf9bd8bc22e15f7d3d10",
  "parent_edition": null,
  "status": "archived",
  "transformation": "deterministic-structural-reading/v3",
  "measures": {
    "documents": 8,
    "sections": 111,
    "words": 3380,
    "concepts": 36,
    "relations": 180
  },
  "visual": {
    "schema": "root-logos-visual-score/v1",
    "seed": 1271597574,
    "palette": [
      "#cbb77a",
      "#e9e5d8",
      "#93b9bb",
      "#9a8cb6",
      "#ad7159",
      "#8aa681"
    ],
    "topology": {
      "nodes": [
        {
          "id": "work",
          "type": "work",
          "label": "Micheas",
          "weight": 1,
          "coordinate": "work"
        },
        {
          "id": "document-1",
          "type": "document",
          "label": "Original argument and apparatus",
          "weight": 1,
          "coordinate": "apparatus:introduction"
        },
        {
          "id": "document-2",
          "type": "document",
          "label": "Chapter 1",
          "weight": 17,
          "coordinate": "chapter:1"
        },
        {
          "id": "document-3",
          "type": "document",
          "label": "Chapter 2",
          "weight": 14,
          "coordinate": "chapter:2"
        },
        {
          "id": "document-4",
          "type": "document",
          "label": "Chapter 3",
          "weight": 13,
          "coordinate": "chapter:3"
        },
        {
          "id": "document-5",
          "type": "document",
          "label": "Chapter 4",
          "weight": 13,
          "coordinate": "chapter:4"
        },
        {
          "id": "document-6",
          "type": "document",
          "label": "Chapter 5",
          "weight": 15,
          "coordinate": "chapter:5"
        },
        {
          "id": "document-7",
          "type": "document",
          "label": "Chapter 6",
          "weight": 17,
          "coordinate": "chapter:6"
        },
        {
          "id": "document-8",
          "type": "document",
          "label": "Chapter 7",
          "weight": 21,
          "coordinate": "chapter:7"
        },
        {
          "id": "concept-1",
          "type": "concept",
          "label": "shall",
          "weight": 111,
          "coordinate": "lexicon:shall"
        },
        {
          "id": "concept-2",
          "type": "concept",
          "label": "lord",
          "weight": 42,
          "coordinate": "lexicon:lord"
        },
        {
          "id": "concept-3",
          "type": "concept",
          "label": "because",
          "weight": 28,
          "coordinate": "lexicon:because"
        },
        {
          "id": "concept-4",
          "type": "concept",
          "label": "thee",
          "weight": 28,
          "coordinate": "lexicon:thee"
        },
        {
          "id": "concept-5",
          "type": "concept",
          "label": "thou",
          "weight": 21,
          "coordinate": "lexicon:thou"
        },
        {
          "id": "concept-6",
          "type": "concept",
          "label": "shalt",
          "weight": 18,
          "coordinate": "lexicon:shalt"
        },
        {
          "id": "concept-7",
          "type": "concept",
          "label": "house",
          "weight": 14,
          "coordinate": "lexicon:house"
        },
        {
          "id": "concept-8",
          "type": "concept",
          "label": "israel",
          "weight": 13,
          "coordinate": "lexicon:israel"
        },
        {
          "id": "concept-9",
          "type": "concept",
          "label": "people",
          "weight": 13,
          "coordinate": "lexicon:people"
        },
        {
          "id": "concept-10",
          "type": "concept",
          "label": "come",
          "weight": 12,
          "coordinate": "lexicon:come"
        },
        {
          "id": "concept-11",
          "type": "concept",
          "label": "even",
          "weight": 11,
          "coordinate": "lexicon:even"
        },
        {
          "id": "concept-12",
          "type": "concept",
          "label": "jacob",
          "weight": 11,
          "coordinate": "lexicon:jacob"
        },
        {
          "id": "concept-13",
          "type": "concept",
          "label": "jerusalem",
          "weight": 10,
          "coordinate": "lexicon:jerusalem"
        },
        {
          "id": "concept-14",
          "type": "concept",
          "label": "many",
          "weight": 10,
          "coordinate": "lexicon:many"
        },
        {
          "id": "concept-15",
          "type": "concept",
          "label": "midst",
          "weight": 10,
          "coordinate": "lexicon:midst"
        },
        {
          "id": "concept-16",
          "type": "concept",
          "label": "hear",
          "weight": 9,
          "coordinate": "lexicon:hear"
        },
        {
          "id": "concept-17",
          "type": "concept",
          "label": "sion",
          "weight": 9,
          "coordinate": "lexicon:sion"
        },
        {
          "id": "concept-18",
          "type": "concept",
          "label": "away",
          "weight": 8,
          "coordinate": "lexicon:away"
        },
        {
          "id": "concept-19",
          "type": "concept",
          "label": "daughter",
          "weight": 8,
          "coordinate": "lexicon:daughter"
        },
        {
          "id": "concept-20",
          "type": "concept",
          "label": "judgement",
          "weight": 8,
          "coordinate": "lexicon:judgement"
        },
        {
          "id": "concept-21",
          "type": "concept",
          "label": "land",
          "weight": 8,
          "coordinate": "lexicon:land"
        },
        {
          "id": "concept-22",
          "type": "concept",
          "label": "make",
          "weight": 8,
          "coordinate": "lexicon:make"
        },
        {
          "id": "concept-23",
          "type": "concept",
          "label": "earth",
          "weight": 7,
          "coordinate": "lexicon:earth"
        },
        {
          "id": "concept-24",
          "type": "concept",
          "label": "forth",
          "weight": 7,
          "coordinate": "lexicon:forth"
        },
        {
          "id": "concept-25",
          "type": "concept",
          "label": "give",
          "weight": 7,
          "coordinate": "lexicon:give"
        },
        {
          "id": "concept-26",
          "type": "concept",
          "label": "hath",
          "weight": 7,
          "coordinate": "lexicon:hath"
        },
        {
          "id": "concept-27",
          "type": "concept",
          "label": "peoples",
          "weight": 7,
          "coordinate": "lexicon:peoples"
        },
        {
          "id": "concept-28",
          "type": "concept",
          "label": "taken",
          "weight": 7,
          "coordinate": "lexicon:taken"
        },
        {
          "id": "concept-29",
          "type": "concept",
          "label": "time",
          "weight": 7,
          "coordinate": "lexicon:time"
        },
        {
          "id": "concept-30",
          "type": "concept",
          "label": "together",
          "weight": 7,
          "coordinate": "lexicon:together"
        },
        {
          "id": "concept-31",
          "type": "concept",
          "label": "unto",
          "weight": 7,
          "coordinate": "lexicon:unto"
        },
        {
          "id": "concept-32",
          "type": "concept",
          "label": "against",
          "weight": 6,
          "coordinate": "lexicon:against"
        },
        {
          "id": "concept-33",
          "type": "concept",
          "label": "christ",
          "weight": 6,
          "coordinate": "lexicon:christ"
        },
        {
          "id": "concept-34",
          "type": "concept",
          "label": "days",
          "weight": 6,
          "coordinate": "lexicon:days"
        },
        {
          "id": "concept-35",
          "type": "concept",
          "label": "evil",
          "weight": 6,
          "coordinate": "lexicon:evil"
        },
        {
          "id": "concept-36",
          "type": "concept",
          "label": "good",
          "weight": 6,
          "coordinate": "lexicon:good"
        }
      ],
      "edges": [
        {
          "from": "document-6",
          "to": "concept-1",
          "relation": "expresses",
          "weight": 26
        },
        {
          "from": "work",
          "to": "document-8",
          "relation": "contains",
          "weight": 21
        },
        {
          "from": "document-8",
          "to": "concept-1",
          "relation": "expresses",
          "weight": 21
        },
        {
          "from": "concept-1",
          "to": "concept-2",
          "relation": "co-occurs",
          "weight": 19
        },
        {
          "from": "document-5",
          "to": "concept-1",
          "relation": "expresses",
          "weight": 18
        },
        {
          "from": "work",
          "to": "document-2",
          "relation": "contains",
          "weight": 17
        },
        {
          "from": "work",
          "to": "document-7",
          "relation": "contains",
          "weight": 17
        },
        {
          "from": "work",
          "to": "document-6",
          "relation": "contains",
          "weight": 15
        },
        {
          "from": "document-3",
          "to": "concept-1",
          "relation": "expresses",
          "weight": 15
        },
        {
          "from": "work",
          "to": "document-3",
          "relation": "contains",
          "weight": 14
        },
        {
          "from": "work",
          "to": "document-4",